{
  "schema_version": "1.0",
  "transformation_batch_id": "seed-batch:learning-export-seed-helper-geo-001",
  "source_learning_pack_id": "learning-export-seed-helper-geo-001",
  "source_learning_export_id": "learning-export-seed-helper-geo-001",
  "transformation_method": "manual",
  "candidates": [
    {
      "candidate_id": "candidate:geo_feature:open-joint:seed-phrase-open-joint",
      "supporting_learning_item_ids": [
        "seed-phrase-open-joint"
      ],
      "confidence": "high",
      "reviewer_decision": "pending",
      "proposed_target_type": "geo_feature",
      "proposed_fields": {
        "name": "open joint",
        "category": "discontinuity feature",
        "mechanism": "joint aperture is visibly open",
        "description": "joint aperture is visibly open",
        "typical_conditions": [
          "slope context",
          "Open joint observed along the left wall."
        ],
        "field_indicators": [
          "joint aperture is visibly open",
          "open joint"
        ],
        "engineering_assessment": [
          "joint aperture is visibly open",
          "Open joint observed along the left wall."
        ],
        "reporting_expressions": [
          "Open joint observed along the left wall.",
          "open joint observed."
        ]
      }
    },
    {
      "candidate_id": "candidate:geo_feature:ravelling:seed-sentence-ravelling",
      "supporting_learning_item_ids": [
        "seed-sentence-ravelling"
      ],
      "confidence": "medium",
      "ambiguity_flags": [
        "sentence_requires_manual_name_review"
      ],
      "reviewer_decision": "pending",
      "proposed_target_type": "geo_feature",
      "proposed_fields": {
        "name": "ravelling",
        "category": "instability feature",
        "mechanism": "Reusable wording for field reporting.",
        "description": "Reusable wording for field reporting.",
        "typical_conditions": [
          "reporting context"
        ],
        "field_indicators": [
          "Reusable wording for field reporting.",
          "Localized ravelling observed beneath the overbreak edge."
        ],
        "engineering_assessment": [
          "Reusable wording for field reporting."
        ],
        "reporting_expressions": [
          "Localized ravelling observed beneath the overbreak edge."
        ]
      }
    },
    {
      "candidate_id": "candidate:geo_feature:detached-block:seed-concept-detached-block",
      "supporting_learning_item_ids": [
        "seed-concept-detached-block"
      ],
      "confidence": "high",
      "reviewer_decision": "pending",
      "proposed_target_type": "geo_feature",
      "proposed_fields": {
        "name": "detached block",
        "category": "instability feature",
        "mechanism": "trend the crack width over repeated inspections",
        "description": "trend the crack width over repeated inspections",
        "typical_conditions": [
          "safety context"
        ],
        "field_indicators": [
          "trend the crack width over repeated inspections",
          "Detached blocks can indicate progressive instability when crack width is increasing."
        ],
        "engineering_assessment": [
          "trend the crack width over repeated inspections"
        ],
        "reporting_expressions": [
          "Detached blocks can indicate progressive instability when crack width is increasing."
        ]
      }
    },
    {
      "candidate_id": "candidate:strategy:hand-scaling:seed-concept-hand-scaling",
      "supporting_learning_item_ids": [
        "seed-concept-hand-scaling"
      ],
      "confidence": "medium",
      "ambiguity_flags": [
        "multiple_target_type_matches"
      ],
      "reviewer_decision": "pending",
      "proposed_target_type": "strategy",
      "proposed_fields": {
        "name": "hand scaling",
        "category": "hazard reduction action",
        "trigger_conditions": [
          "Treat as an immediate hazard-reduction action.",
          "support trigger context"
        ],
        "actions": [
          "Hand scaling should be completed before the next inspection cycle when loose rock is exposed.",
          "Treat as an immediate hazard-reduction action."
        ],
        "reporting_expressions": [
          "Hand scaling should be completed before the next inspection cycle when loose rock is exposed."
        ]
      }
    },
    {
      "candidate_id": "candidate:geo_material:fault-gouge:seed-phrase-fault-gouge",
      "supporting_learning_item_ids": [
        "seed-phrase-fault-gouge"
      ],
      "confidence": "high",
      "reviewer_decision": "pending",
      "proposed_target_type": "geo_material",
      "proposed_fields": {
        "name": "fault gouge",
        "category": "geological material",
        "description": "clay-rich sheared infill along a fault plane",
        "key_properties": [
          "clay-rich sheared infill along a fault plane",
          "fault gouge"
        ],
        "engineering_behaviour": [
          "Fault gouge exposed in the sidewall seam.",
          "clay-rich sheared infill along a fault plane"
        ],
        "reporting_expressions": [
          "Fault gouge exposed in the sidewall seam.",
          "fault gouge observed."
        ]
      }
    }
  ]
}
